{
  "assets": [
    {
      "arch": "any",
      "build": "fetch",
      "group": "sources",
      "kind": "file",
      "name": "zlib-1.3.1-sources.tar.gz",
      "os": "any",
      "role": "artifact",
      "sha256": "87663f4f177de90759cb1fe1cd671495f36b70edfc70c68fa6881b9dc479a148",
      "size": 1000000,
      "target": "sources",
      "url_template": "https://github.com/{repository}/releases/download/{tag}/{name}"
    },
    {
      "arch": "any",
      "build": "fetch",
      "group": "sources",
      "kind": "file",
      "name": "zlib-1.3.1-sources.manifest.json",
      "os": "any",
      "role": "manifest",
      "sha256": "10ba240140a2e2b0c516ec67add5dd4d42cbee50af9b3c0e691936fb3353f860",
      "size": 1000000,
      "target": "sources-manifest",
      "url_template": "https://github.com/{repository}/releases/download/{tag}/{name}"
    }
  ],
  "attestation": {
    "predicate_type": "https://slsa.dev/provenance/v1",
    "provider": "github-artifact-attestation",
    "signer_workflow": "wstein/bundledock-third-party-sources/.github/workflows/release-build.yml"
  },
  "build": {
    "run_attempt": 1,
    "run_id": 12345678901,
    "stw_version": "v0.1.0",
    "workflow": ".github/workflows/release-build.yml"
  },
  "checksums": {
    "name": "SHA256SUMS",
    "sha256": "99d2a29aa6a423cbb28be7045d0e90118ca95e0c4e9dc772f9d35f042f82e9fb",
    "size": 412
  },
  "commit": "4e7f3b62e29abc3b6014b68eb9b7ddfce9c9b702",
  "kind": "release-record",
  "manifest": {
    "name": "build-manifest.json",
    "sha256": "13a94b12f7295e2ef26ef50084f73fdf7882372355edae8c5ec834bc811c9104",
    "size": 2210
  },
  "product": "zlib",
  "project": "BundleDock third-party sources",
  "repository": "wstein/bundledock-third-party-sources",
  "schema_version": 1,
  "source_date_epoch": 1760000000,
  "tag": "zlib-v1.3.1",
  "version": "1.3.1"
}
